Id,Pres ID,time,title,presenter
332,1408052,4:09 PM - 4:30 PM,"Should we invest in non-occupational post-exposure prophylaxis (nPEP) as a tool to end the HIV epidemic? ConDebate Style Speaker:  Latesha Elopre, MD (she/her/hers) – University of Alabama of Birmingham","Debate Style Speaker:  Latesha Elopre, MD (she/her/hers) – University of Alabama of Birmingham"
334,1423438,4:45 PM - 5:05 PM,Awards Presentation,N/A
334,1498384,5:05 PM - 5:20 PM,"IDSA FEATURED ORAL ABSTRACT: MVA-BN Induces a Low Avidity, Non-Durable Humoral Response Against Mpox VirusPresenting Author:  Angelica C. Kottkamp, MD (she/her/hers) – NYU Grossman School of MedicineCo-Author:  Aaron Oom, Phd – New York University Grossman School of MedicineCo-Author:  Kesi K. Wilson, BS – NYU Grossman School of MedicineCo-Author:  Miilani E. Yonatan, Bachelor's of Science – NYU Langone HealthCo-Author:  Stephanie Rettig, MPH – NYU Langone Vaccine CenterCo-Author:  Heekoung Youn, BSN/MA – NyusimCo-Author:  Michael Tuen, BS – NYU Langone HealthCo-Author:  Hayley Belli, PhD – New York University Grossman School of MedicineCo-Author:  Jane R. Zucker, MD, MSc, FIDSA – NYC Department of Health and Mental HygieneCo-Author:  Jennifer Rosen, MD – NYC Department of Health and Mental HygieneCo-Author:  Marie I. Samanovic, PhD – NYU Grossman School of MedicineCo-Author:  Ralf Duerr, MD PhD – NYU Langone HealthCo-Author:  Mark J. Mulligan, M.D. – NYU Grossman School of Medicine","Presenting Author:  Angelica C. Kottkamp, MD (she/her/hers) – NYU Grossman School of MedicineCo-Author:  Aaron Oom, Phd – New York University Grossman School of MedicineCo-Author:  Kesi K. Wilson, BS – NYU Grossman School of MedicineCo-Author:  Miilani E. Yonatan, Bachelor's of Science – NYU Langone HealthCo-Author:  Stephanie Rettig, MPH – NYU Langone Vaccine CenterCo-Author:  Heekoung Youn, BSN/MA – NyusimCo-Author:  Michael Tuen, BS – NYU Langone HealthCo-Author:  Hayley Belli, PhD – New York University Grossman School of MedicineCo-Author:  Jane R. Zucker, MD, MSc, FIDSA – NYC Department of Health and Mental HygieneCo-Author:  Jennifer Rosen, MD – NYC Department of Health and Mental HygieneCo-Author:  Marie I. Samanovic, PhD – NYU Grossman School of MedicineCo-Author:  Ralf Duerr, MD PhD – NYU Langone HealthCo-Author:  Mark J. Mulligan, M.D. – NYU Grossman School of Medicine"
334,1500698,5:20 PM - 5:45 PM,"Advances and Challenges in Fungal DiagnosticsSpeaker:  Kimberly Hanson, MD, MHS – University of Utah","Speaker:  Kimberly Hanson, MD, MHS – University of Utah"
340,1487487,8:00 AM - 9:00 AM,Bioelectricity Antimicrobial Susceptibility Testing (BeAST) by Cytecom LtdSpeaker:  Magdalena Karlikowska – Cytecom Ltd,Speaker:  Magdalena Karlikowska – Cytecom Ltd
340,1487490,8:00 AM - 9:00 AM,"The PhAST BC GN Assay: Rapid phenotypic AST for bloodstream infectionsSpeaker:  Sankha S. Basu, MD PhD (he/him/his) – PhAST Corp.","Speaker:  Sankha S. Basu, MD PhD (he/him/his) – PhAST Corp."
340,1487489,8:00 AM - 9:00 AM,"Deepull: Ullcore BSI test - One hour direct-from-blood multiplex PCR targeting 95% of sepsis-causing pathogens and select resistant markersSpeaker:  kimberle chapin-robertson, MD – Deepull, Barcelona Spain","Speaker:  kimberle chapin-robertson, MD – Deepull, Barcelona Spain"
340,1487491,8:00 AM - 9:00 AM,Pathogen Whole Genome Sequencing for Rapid ID & AST Directly from Multiple Clinical Sample TypesSpeaker:  Doug Kwon,Speaker:  Doug Kwon
341,1407879,8:00 AM - 8:30 AM,"AAP Redbook: Highlights for 2024-2027 Part 1Speaker:  Chandy John, MD, MS – Indiana University","Speaker:  Chandy John, MD, MS – Indiana University"
341,1407878,8:30 AM - 9:00 AM,"AAP Redbook: Highlights for 2024-2027 Part 2Speaker:  Sean T. O'Leary, MD, MPH (he/him/his) – University of Colorado School of Medicine and Children's Hospital Colorado","Speaker:  Sean T. O'Leary, MD, MPH (he/him/his) – University of Colorado School of Medicine and Children's Hospital Colorado"
342,1407885,8:00 AM - 8:30 AM,"Medical Tourist Beware! A Review of Recent Outbreaks Related to Medical TourismSpeaker:  Jeremy A. Gold, MD, MS (he/him/his) – Centers for Disease Control and Prevention","Speaker:  Jeremy A. Gold, MD, MS (he/him/his) – Centers for Disease Control and Prevention"
342,1407884,8:30 AM - 9:00 AM,"Anatomy of a Recall: Outbreaks Due to Product ContaminationSpeaker:  Stacy Park, MD (she/her/hers) – University of Virginia Medical Center","Speaker:  Stacy Park, MD (she/her/hers) – University of Virginia Medical Center"
343,1407900,8:00 AM - 8:20 AM,"Case based discussion on optimizing billing and coding to impact reimbursement and quality metricsSpeaker:  Timothy Sullivan, MD (he/him/his) – Icahn School of Medicine at Mount Sinai","Speaker:  Timothy Sullivan, MD (he/him/his) – Icahn School of Medicine at Mount Sinai"
343,1407899,8:20 AM - 8:40 AM,"Coding For Our Value--ID Complex CareSpeaker:  Amy Beth Kressel, MD, MS (she/her/hers) – Indiana University School of Medicine","Speaker:  Amy Beth Kressel, MD, MS (she/her/hers) – Indiana University School of Medicine"
343,1407898,8:40 AM - 9:00 AM,"Practical methods to enhance ID physician reimbursementSpeaker:  Asher J. Schranz, MD, MPH (he/him/his) – University of North Carolina","Speaker:  Asher J. Schranz, MD, MPH (he/him/his) – University of North Carolina"
344,1407905,8:00 AM - 8:30 AM,Bronchiectasis and Non-Tuberculosis MycobacteriaSpeaker:  Anne O'Donnell,Speaker:  Anne O'Donnell
344,1407904,8:30 AM - 9:00 AM,"Current Treatment Approach for NTM lung InfectionSpeaker:  Charles L. Daley, MD (he/him/his) – National Jewish Health","Speaker:  Charles L. Daley, MD (he/him/his) – National Jewish Health"
345,1407934,8:00 AM - 8:30 AM,"Beta-Lactam Adjunctive Therapy for Difficult Staphylococcus aureus InfectionsSpeaker:  Daniel B. Chastain, Pharm.D., BCIDP, AAHIVP, FIDSA – University of Georgia College of Pharmacy","Speaker:  Daniel B. Chastain, Pharm.D., BCIDP, AAHIVP, FIDSA – University of Georgia College of Pharmacy"
345,1407933,8:30 AM - 9:00 AM,"Beta-Lactam Adjunctive Therapy for Difficult Enterococcal InfectionsSpeaker:  Rachel Foster, PharmD, MBA, BCIDP (she/her/hers) – Intermountain Medical Center","Speaker:  Rachel Foster, PharmD, MBA, BCIDP (she/her/hers) – Intermountain Medical Center"
346,1408026,8:00 AM - 8:30 AM,"Utilizing Clinic-based Interventions to Re-engage the Struggling PatientSpeaker:  Tara Vijayan, MD, M.P.H. (she/her/hers) – University of California Los Angeles, David Geffen School of Medicine","Speaker:  Tara Vijayan, MD, M.P.H. (she/her/hers) – University of California Los Angeles, David Geffen School of Medicine"
346,1408027,8:30 AM - 9:00 AM,"Managing Depression and Anxiety in the HIV ClinicSpeaker:  Elizabeth Holcomb, MD (she/her/hers) – CrescentCare","Speaker:  Elizabeth Holcomb, MD (she/her/hers) – CrescentCare"
347,1408033,8:00 AM - 8:30 AM,"Review of Progress and Challenges in Bacterial Meningitis and EncephalitisSpeaker:  Rodrigo Hasbun, MD MPH FIDSA – UT Health Mc Govern Medical School","Speaker:  Rodrigo Hasbun, MD MPH FIDSA – UT Health Mc Govern Medical School"
347,1408032,8:30 AM - 9:00 AM,"Updates in viral encephalitis and emerging conceptsSpeaker:  J. David Beckham, MD (he/him/his) – UT Southwestern Medical Center","Speaker:  J. David Beckham, MD (he/him/his) – UT Southwestern Medical Center"
348,1408041,8:00 AM - 8:30 AM,"What We Know So FarSpeaker:  Catherine Chappell, MD, MSc (she/her/hers) – University of Pittsburgh","Speaker:  Catherine Chappell, MD, MSc (she/her/hers) – University of Pittsburgh"
348,1408040,8:30 AM - 9:00 AM,"Implementation Successes and ChallengesSpeaker:  Madeline McCrary, MD (she/her/hers) – Washington University in St. Louis","Speaker:  Madeline McCrary, MD (she/her/hers) – Washington University in St. Louis"
349,1408055,8:00 AM - 8:30 AM,"Local Metrics to Push Stewardship Programs ForwardSpeaker:  Kari A. Mergenhagen, PharmD (she/her/hers) – VA Buffalo","Speaker:  Kari A. Mergenhagen, PharmD (she/her/hers) – VA Buffalo"
349,1408056,8:30 AM - 9:00 AM,"Not Just Antibiotic Use: Patient Outcomes Data to Support StewardshipSpeaker:  Nicole M. Poole, MD, MPH (she/her/hers) – University of Colorado School of Medicine","Speaker:  Nicole M. Poole, MD, MPH (she/her/hers) – University of Colorado School of Medicine"
350,1408127,8:00 AM - 8:30 AM,"Transforming Your Work in Clinical Education: Pearls for Producing ScholarshipSpeaker:  Debra Palazzi, MD, MEd – Baylor College of Medicine","Speaker:  Debra Palazzi, MD, MEd – Baylor College of Medicine"
350,1408128,8:30 AM - 9:00 AM,"Teaching ID by PodcastSpeaker:  Sara W. Dong, MD (she/her/hers) – Beth Israel Deaconess Medical Center & Boston Children's Hospital","Speaker:  Sara W. Dong, MD (she/her/hers) – Beth Israel Deaconess Medical Center & Boston Children's Hospital"
355,1464242,9:15 AM - 9:35 AM,Awards Presentation,N/A
355,1500696,9:35 AM - 10:00 AM,"Beta-lactamase Inhibitors: Advancements, Challenges, and OpportunitiesSpeaker:  Robert A. Bonomo, MD (he/him/his) – Case Western Reserve University/ Louis Stokes Cleveland VA Medical Center","Speaker:  Robert A. Bonomo, MD (he/him/his) – Case Western Reserve University/ Louis Stokes Cleveland VA Medical Center"
359,1407876,10:30 AM - 10:55 AM,"How Did We Get Here?: How Law Impacts Population Health & Clinical Disparities in IDSpeaker:  Michael Koster, MD – Alpert Medical School of Brown University","Speaker:  Michael Koster, MD – Alpert Medical School of Brown University"
359,1407874,10:55 AM - 11:20 AM,"Achieving Health Equity by Creating Diversity in the era of a Colorblind ConstitutionSpeaker:  Florence Momplaisir, MD, MSHP, FACP (she/her/hers) – University of Pennsylvania","Speaker:  Florence Momplaisir, MD, MSHP, FACP (she/her/hers) – University of Pennsylvania"
359,1407875,11:20 AM - 11:45 AM,"Using Psychological Safety to Create an Inclusive Learning EnvironmentSpeaker:  Sabina D. Holland, MD (she/her/hers) – Brown University","Speaker:  Sabina D. Holland, MD (she/her/hers) – Brown University"
360,1407894,10:30 AM - 10:55 AM,"Three days of antibiotics for uncomplicated community-acquired pneumonia: Ready for prime time?Speaker:  Lisa Davidson, MD (she/her/hers) – Atrium Health","Speaker:  Lisa Davidson, MD (she/her/hers) – Atrium Health"
360,1407892,10:55 AM - 11:20 AM,"Do we still need to treat group A Streptococcus pharyngitis for 10 days?Speaker:  Alison C. Tribble, MD, MSCE – University of Michigan","Speaker:  Alison C. Tribble, MD, MSCE – University of Michigan"
360,1407893,11:20 AM - 11:45 AM,"Daptomycin and statins: To hold or not to holdSpeaker:  David R. Ha, PharmD, BCIDP – Stanford Health Care","Speaker:  David R. Ha, PharmD, BCIDP – Stanford Health Care"
361,1407908,10:30 AM - 10:55 AM,"Prediction Models 101: The DataSpeaker:  Katherine E. Goodman, PhD, JD – University of Maryland School of Medicine","Speaker:  Katherine E. Goodman, PhD, JD – University of Maryland School of Medicine"
361,1407907,10:55 AM - 11:20 AM,"Prediction Models 101: The ModelsSpeaker:  Shengpu Tang, PhD (he/him/his) – Emory University","Speaker:  Shengpu Tang, PhD (he/him/his) – Emory University"
361,1407906,11:20 AM - 11:45 AM,"Prediction Models 101: The Implementation and AutomationSpeaker:  Eili Klein, PhD – Johns Hopkins School of Medicine","Speaker:  Eili Klein, PhD – Johns Hopkins School of Medicine"
362,1494613,10:30 AM - 10:50 AM,"Global Epidemiology of Mpox in 2024Speaker:  Placibe Mbala – Institut National de Recherche BiomÃ©dicale, DRC","Speaker:  Placibe Mbala – Institut National de Recherche BiomÃ©dicale, DRC"
362,1494618,10:50 AM - 11:10 AM,"Palm007: Clinical Efficacy of Tecovirimat in Hospitalized Patients with MpoxSpeaker:  Olivier Tshiani – Leidos  Biomedical research Co-Author:  Lori E. Dodd, PhD – The National Institute of Allergy and Infectious Diseases, National Institutes of HealthCo-Author:  Veronique Nussenblatt","Speaker:  Olivier Tshiani – Leidos  Biomedical research Co-Author:  Lori E. Dodd, PhD – The National Institute of Allergy and Infectious Diseases, National Institutes of HealthCo-Author:  Veronique Nussenblatt"
362,1494617,11:10 AM - 11:30 AM,"Alternative Antiviral Therapies for Treating Severe Mpox InfectionSpeaker:  Timothy Wilkin, MD MPH – University of California San Diego","Speaker:  Timothy Wilkin, MD MPH – University of California San Diego"
362,1494616,11:30 AM - 11:45 AM,"Challenging Issues in Mpox VaccinationSpeaker:  Agam Rao, MD (she/her/hers) – Centers for Disease Control and Prevention","Speaker:  Agam Rao, MD (she/her/hers) – Centers for Disease Control and Prevention"
363,1408002,10:30 AM - 10:55 AM,"The impact of antimicrobial resistance in patients with hematological malignancies and hematopoietic stem cell transplant recipientsSpeaker:  Sarah B. Doernberg, MD, MAS (she/her/hers) – University of California, San Francisco","Speaker:  Sarah B. Doernberg, MD, MAS (she/her/hers) – University of California, San Francisco"
363,1408004,10:55 AM - 11:20 AM,"Is it time to re-design the empiric antibacterial approach in febrile neutropenia?Speaker:  Carlota Gudiol, MD, PhD (she/her/hers) – Bellvitge University Hospital","Speaker:  Carlota Gudiol, MD, PhD (she/her/hers) – Bellvitge University Hospital"
363,1408003,11:20 AM - 11:45 AM,"Quinolone prophylaxis: a double-edged sword?Speaker:  Malgorzata Mikulska, MD, PhD (she/her/hers) – University of Genova","Speaker:  Malgorzata Mikulska, MD, PhD (she/her/hers) – University of Genova"
364,1408018,10:30 AM - 10:55 AM,"Viral AMR DetectionSpeaker:  Kimberly Hanson, MD, MHS – University of Utah","Speaker:  Kimberly Hanson, MD, MHS – University of Utah"
364,1408017,10:55 AM - 11:20 AM,"Fungal AMR DetectionSpeaker:  Amir Semouydsavi, VMD. PhD. FECMM (he/him/his) – National Institutes of Health, Clinical Center","Speaker:  Amir Semouydsavi, VMD. PhD. FECMM (he/him/his) – National Institutes of Health, Clinical Center"
364,1408016,11:20 AM - 11:45 AM,"Bacterial AMR DetectionSpeaker:  Lars Westblade, PhD – Weill Cornell Medicine","Speaker:  Lars Westblade, PhD – Weill Cornell Medicine"
365,1408029,10:30 AM - 10:55 AM,"The Big Picture: Our National Framework For Caring For Patients With Special Pathogens.Speaker:  Aneesh K. Mehta, MD (he/him/his) – Emory University School of Medicine","Speaker:  Aneesh K. Mehta, MD (he/him/his) – Emory University School of Medicine"
365,1408028,10:55 AM - 11:20 AM,"Preparing your Hospital: From Identify, Isolate and Inform to Simulation and TrainingSpeaker:  Kari Simonsen, MD, MBA (she/her/hers) – University of Nebraska Medical Center","Speaker:  Kari Simonsen, MD, MBA (she/her/hers) – University of Nebraska Medical Center"
365,1408030,11:20 AM - 11:45 AM,The Bioethics of Caring for a patient with a Special Pathogen: family-centered care and beyondSpeaker:  Vanessa Madrigal,Speaker:  Vanessa Madrigal
366,1408046,10:30 AM - 10:55 AM,"What's the latest data and experience on LAI treatment and prevention?Speaker:  Raphael J. Landovitz, MD, MSc – UCLA Center for Clinical AIDS Research & Education","Speaker:  Raphael J. Landovitz, MD, MSc – UCLA Center for Clinical AIDS Research & Education"
366,1408045,10:55 AM - 11:20 AM,"PEPFAR:  Strategies to accelerate towards ending the epidemic and sustaining the gainsSpeaker:  Michael J A Reid, MD MPH (he/him/his) – PEPFAR, Bureau of Global Health Security and Diplomacy, US State Department","Speaker:  Michael J A Reid, MD MPH (he/him/his) – PEPFAR, Bureau of Global Health Security and Diplomacy, US State Department"
366,1408044,11:20 AM - 11:45 AM,"Treatment and prevention pipeline: What's coming?Speaker:  Susan L. Koletar, MD – Ohio State University","Speaker:  Susan L. Koletar, MD – Ohio State University"
367,1498446,10:30 AM - 10:45 AM,"Comparative Evaluation of Low Versus High Doses of Rifampin for the Treatment of Staphylococcal Bone and Joint Infections: an open-label, randomized, controlled non-inferiority trial (EVRIOS) Presenting Author:  Cedric Arvieux, MD (he/him/his) – CHU de RennesCo-Author:  Jean-Marc Chapplain, MD – CHU de RennesCo-Author:  Anne Jolivet-Gougeon, PharmD, PHD – CHU RENNESCo-Author:  Jean-FranÃ§ois Morcet, n/a – CHU RENNESCo-Author:  Violaine Benoit, n/a – CHU RENNESCo-Author:  Cecile Lefeuvre, n/a – CHU RENNESCo-Author:  Florian Lemaitre, PharmD – CHU RENNESCo-Author:  Nathalie Asseray, MD – CHU DE NANTES - HOTEL DIEUCo-Author:  AurÃ©lien Lorleac'h, MD – CH BRETAGNE SUDCo-Author:  Frederic Antoine Dauchy, MD – CHU BORDEAUXCo-Author:  Thomas Guimard, MD – CHD VENDEECo-Author:  Gwenael Lemoal, MD – CHU POITIERSCo-Author:  ValÃ©rie Gaborieau, MD – CH PAUCo-Author:  GrÃ©gory Corvaisier, MD – CH VANNESCo-Author:  Rodolphe Buzele, MD – CH SAINT-BRIEUCCo-Author:  Pierre Delobel, MD – CHU TOULOUSECo-Author:  Fabien Fily, MD – CH SAINT-MALOCo-Author:  Pierre Abgueguen, MD – CHU ANGERSCo-Author:  Jocelyn Michon, MD – CHU DE CAENCo-Author:  Florence Suy, MD – HÃ´pital PrivÃ© Jean Mermoz - Clinique du Parc / LYONCo-Author:  Anne MÃ©heut, n/a – CHU RENNESCo-Author:  marie Gheno, n/a – CHU DE RENNESCo-Author:  Maja Ratajczak, PharmD, PHD – CHU de RennesCo-Author:  AnaÃ¯s GrÃ¨ves, n/a – CHU BRESTCo-Author:  CÃ©line Thomas, n/a – CHU POITIERSCo-Author:  Mustapha Ahmim, n/a – CHU DE RENNESCo-Author:  Romain Muraz, n/a – CHU DE RENNESCo-Author:  Bellec Laurent, MD – CH de PontivyCo-Author:  Cailleaux Marine, MD – CHU de RennesCo-Author:  Lecomte Raphael, MD – CHU de NantesCo-Author:  SÃ©verine Ansart, MD, PHD – CHU DE BRESTCo-Author:  Louis Bernard, MD/PHD – CHU TOURS","Presenting Author:  Cedric Arvieux, MD (he/him/his) – CHU de RennesCo-Author:  Jean-Marc Chapplain, MD – CHU de RennesCo-Author:  Anne Jolivet-Gougeon, PharmD, PHD – CHU RENNESCo-Author:  Jean-FranÃ§ois Morcet, n/a – CHU RENNESCo-Author:  Violaine Benoit, n/a – CHU RENNESCo-Author:  Cecile Lefeuvre, n/a – CHU RENNESCo-Author:  Florian Lemaitre, PharmD – CHU RENNESCo-Author:  Nathalie Asseray, MD – CHU DE NANTES - HOTEL DIEUCo-Author:  AurÃ©lien Lorleac'h, MD – CH BRETAGNE SUDCo-Author:  Frederic Antoine Dauchy, MD – CHU BORDEAUXCo-Author:  Thomas Guimard, MD – CHD VENDEECo-Author:  Gwenael Lemoal, MD – CHU POITIERSCo-Author:  ValÃ©rie Gaborieau, MD – CH PAUCo-Author:  GrÃ©gory Corvaisier, MD – CH VANNESCo-Author:  Rodolphe Buzele, MD – CH SAINT-BRIEUCCo-Author:  Pierre Delobel, MD – CHU TOULOUSECo-Author:  Fabien Fily, MD – CH SAINT-MALOCo-Author:  Pierre Abgueguen, MD – CHU ANGERSCo-Author:  Jocelyn Michon, MD – CHU DE CAENCo-Author:  Florence Suy, MD – HÃ´pital PrivÃ© Jean Mermoz - Clinique du Parc / LYONCo-Author:  Anne MÃ©heut, n/a – CHU RENNESCo-Author:  marie Gheno, n/a – CHU DE RENNESCo-Author:  Maja Ratajczak, PharmD, PHD – CHU de RennesCo-Author:  AnaÃ¯s GrÃ¨ves, n/a – CHU BRESTCo-Author:  CÃ©line Thomas, n/a – CHU POITIERSCo-Author:  Mustapha Ahmim, n/a – CHU DE RENNESCo-Author:  Romain Muraz, n/a – CHU DE RENNESCo-Author:  Bellec Laurent, MD – CH de PontivyCo-Author:  Cailleaux Marine, MD – CHU de RennesCo-Author:  Lecomte Raphael, MD – CHU de NantesCo-Author:  SÃ©verine Ansart, MD, PHD – CHU DE BRESTCo-Author:  Louis Bernard, MD/PHD – CHU TOURS"
367,1498442,10:45 AM - 11:00 AM,"Predictors of Undetectable HDV RNA 48 weeks after completion of finite treatment with Bulevirtide and Pegylated-Interferon Alpha 2aPresenting Author:  Pavel Bogomolov, MD, Ph.D (he/him/his) – M.F. Vladimirsky Moscow Regional Research and Clinical Institute, Moscow, Russian FederationCo-Author:  Tatyana Stepanova, MD – LLC Clinic of Modern Medicine, Moscow, Russian FederationCo-Author:  Viacheslav Morozov, MD, PhD – LLC Medical Company Hepatolog, Samara, Russian FederationCo-Author:  Tarik Asselah, PhD – Hopital Beaujob APHP, Universite de Paris, INSERMCo-Author:  Fabien Zoulim, MD, PhD – Hospital Croix RousseCo-Author:  Adrian Streinu-Cercel, PhD – Matei Bals National Institute of Infectious Diseases, Bucharest, Romania; ""Carol Davila"" University of Medicine and PharmacyCo-Author:  George Sebastian Gherlan, MD, PhD – ""Carol Davila"" University of Medicine and Pharmacy, Bucharest, Romania; Dr. Victor Babes FoundationCo-Author:  Olga Sagalova, MD, PhD – South Ural State Medical University, Chelyabinsk, Russian FederationCo-Author:  Dana Tedesco, PhD – Gilead Sciences, Inc.Co-Author:  Renee-Claude Mercier, PharmD – Gilead Sciences, Inc.Co-Author:  Lei Ye, PhD – Gilead Sciences, Inc.Co-Author:  Dmitry Manuilov, MD – Gilead Sciences, Inc.Co-Author:  Audrey Lau, MD, PhD – Gilead Sciences, Inc.Co-Author:  Marc Bourliere, MD, PhD – Hopital Saint JosephCo-Author:  Vladimir Chulanov, MD, PhD – Sechenov University","Presenting Author:  Pavel Bogomolov, MD, Ph.D (he/him/his) – M.F. Vladimirsky Moscow Regional Research and Clinical Institute, Moscow, Russian FederationCo-Author:  Tatyana Stepanova, MD – LLC Clinic of Modern Medicine, Moscow, Russian FederationCo-Author:  Viacheslav Morozov, MD, PhD – LLC Medical Company Hepatolog, Samara, Russian FederationCo-Author:  Tarik Asselah, PhD – Hopital Beaujob APHP, Universite de Paris, INSERMCo-Author:  Fabien Zoulim, MD, PhD – Hospital Croix RousseCo-Author:  Adrian Streinu-Cercel, PhD – Matei Bals National Institute of Infectious Diseases, Bucharest, Romania; ""Carol Davila"" University of Medicine and PharmacyCo-Author:  George Sebastian Gherlan, MD, PhD – ""Carol Davila"" University of Medicine and Pharmacy, Bucharest, Romania; Dr. Victor Babes FoundationCo-Author:  Olga Sagalova, MD, PhD – South Ural State Medical University, Chelyabinsk, Russian FederationCo-Author:  Dana Tedesco, PhD – Gilead Sciences, Inc.Co-Author:  Renee-Claude Mercier, PharmD – Gilead Sciences, Inc.Co-Author:  Lei Ye, PhD – Gilead Sciences, Inc.Co-Author:  Dmitry Manuilov, MD – Gilead Sciences, Inc.Co-Author:  Audrey Lau, MD, PhD – Gilead Sciences, Inc.Co-Author:  Marc Bourliere, MD, PhD – Hopital Saint JosephCo-Author:  Vladimir Chulanov, MD, PhD – Sechenov University"
367,1498438,11:00 AM - 11:15 AM,"Improving Traditional Registrational Trial Endpoints: Development and Application of a Desirability of Outcome Ranking (DOOR) Endpoint for Acute Bacterial Skin and Skin-Structure InfectionsPresenting Author:  Jessica Howard-Anderson, MD, MSc (she/her/hers) – Emory UniversityCo-Author:  Toshimitsu Hamasaki, PhD – The George Washington UniversityCo-Author:  Lizhao Ge, MAS – George Washington UniversityCo-Author:  Deborah Collyar, B.Sci – Patient Advocates In Research (PAIR)Co-Author:  Sumathi Nambiar, MD MPH – Johnson and JohnsonCo-Author:  Carol Hill, PhD – Duke Clinical Research InstituteCo-Author:  Holly S. Geres, BS – Duke Clinical Research InstituteCo-Author:  Sara E. Cosgrove, MD, MS – Johns Hopkins School of MedicineCo-Author:  Thomas L. Holland, MD – Duke University Medical CenterCo-Author:  Sarah B. Doernberg, MD, MAS (she/her/hers) – University of California, San FranciscoCo-Author:  Henry Chambers, MD – University of California San FranciscoCo-Author:  Vance G. Fowler, MD, MHS – Duke University Medical CenterCo-Author:  Scott R. Evans, PhD, M.S. (he/him/his) – Milken Institute School of Public HealthCo-Author:  Helen Boucher, MD (she/her/hers) – Tufts University School of Medicine","Presenting Author:  Jessica Howard-Anderson, MD, MSc (she/her/hers) – Emory UniversityCo-Author:  Toshimitsu Hamasaki, PhD – The George Washington UniversityCo-Author:  Lizhao Ge, MAS – George Washington UniversityCo-Author:  Deborah Collyar, B.Sci – Patient Advocates In Research (PAIR)Co-Author:  Sumathi Nambiar, MD MPH – Johnson and JohnsonCo-Author:  Carol Hill, PhD – Duke Clinical Research InstituteCo-Author:  Holly S. Geres, BS – Duke Clinical Research InstituteCo-Author:  Sara E. Cosgrove, MD, MS – Johns Hopkins School of MedicineCo-Author:  Thomas L. Holland, MD – Duke University Medical CenterCo-Author:  Sarah B. Doernberg, MD, MAS (she/her/hers) – University of California, San FranciscoCo-Author:  Henry Chambers, MD – University of California San FranciscoCo-Author:  Vance G. Fowler, MD, MHS – Duke University Medical CenterCo-Author:  Scott R. Evans, PhD, M.S. (he/him/his) – Milken Institute School of Public HealthCo-Author:  Helen Boucher, MD (she/her/hers) – Tufts University School of Medicine"
