Id,Pres ID,time,title,presenter
480,1498290,1:57 PM - 2:09 PM,"Feeling the Vibes: An Investigation Into Resident Physician Antibiotic Prescribing PracticesPresenting Author:  David Dickson, MD, PhD – StanfordCo-Author:  Jaime Jordan, MD, MAEd – UCLACo-Author:  Tara Vijayan, MD, M.P.H. (she/her/hers) – University of California Los Angeles, David Geffen School of Medicine","Presenting Author:  David Dickson, MD, PhD – StanfordCo-Author:  Jaime Jordan, MD, MAEd – UCLACo-Author:  Tara Vijayan, MD, M.P.H. (she/her/hers) – University of California Los Angeles, David Geffen School of Medicine"
480,1498486,2:09 PM - 2:21 PM,"Increasing Diversity, Equity, and Inclusion in the Antimicrobial Stewardship Workforce through the SIDP Certificate ProgramPresenting Author:  Sarah Eudaley, PharmD, BCPS (she/her/hers) – Society of Infectious Diseases PharmacistsCo-Author:  Melissa D. Johnson, PharmD MHS AAHIVP (she/her/hers) – Duke UniversityCo-Author:  Meghan N. Jeffres, PharmD (she/her/hers) – University of Colorado Anschutz Medical CampusCo-Author:  Kenneth Lawrence, BS, PharmD – Society of Infectious Diseases PharmacistsCo-Author:  Scott J. Bergman, PharmD – Nebraska MedicineCo-Author:  Hermsen D. Elizabeth, PharmD, MBA – Pfizer, Inc.Co-Author:  Tracy N. Zembles, PharmD, BCPS, BCIDP – Children's Wisconsin","Presenting Author:  Sarah Eudaley, PharmD, BCPS (she/her/hers) – Society of Infectious Diseases PharmacistsCo-Author:  Melissa D. Johnson, PharmD MHS AAHIVP (she/her/hers) – Duke UniversityCo-Author:  Meghan N. Jeffres, PharmD (she/her/hers) – University of Colorado Anschutz Medical CampusCo-Author:  Kenneth Lawrence, BS, PharmD – Society of Infectious Diseases PharmacistsCo-Author:  Scott J. Bergman, PharmD – Nebraska MedicineCo-Author:  Hermsen D. Elizabeth, PharmD, MBA – Pfizer, Inc.Co-Author:  Tracy N. Zembles, PharmD, BCPS, BCIDP – Children's Wisconsin"
480,1498483,2:21 PM - 2:33 PM,"Implementation and Evaluation of an Interactive Infectious Diseases Online Curriculum for Trainees on ID electivesPresenting Author:  Gayathri Krishnan, MD – Washington University School of MedicineCo-Author:  Caline Mattar, MD – Washington University School of MedicineCo-Author:  Nigar Kirmani, MD – Washington University School Of MedicineCo-Author:  Steven Lawrence, M.D., M.Sc.  – Washington University in Saint Louis School of Medicine","Presenting Author:  Gayathri Krishnan, MD – Washington University School of MedicineCo-Author:  Caline Mattar, MD – Washington University School of MedicineCo-Author:  Nigar Kirmani, MD – Washington University School Of MedicineCo-Author:  Steven Lawrence, M.D., M.Sc.  – Washington University in Saint Louis School of Medicine"
480,1498479,2:33 PM - 2:45 PM,"Effects of Legislation Restricting Reproductive and LGBT+ Rights on Infectious Disease Fellowship Match RatesPresenting Author:  Michael Z. Chen, MD (he/him/his) – University of ChicagoCo-Author:  Alan L. Hutchison, MD, PhD – University of Chicago MedicineCo-Author:  Aniruddha Hazra, MD (he/him/his) – University of ChicagoCo-Author:  Anna Czapar, MD/PhD (she/her/hers) – University of Chicago","Presenting Author:  Michael Z. Chen, MD (he/him/his) – University of ChicagoCo-Author:  Alan L. Hutchison, MD, PhD – University of Chicago MedicineCo-Author:  Aniruddha Hazra, MD (he/him/his) – University of ChicagoCo-Author:  Anna Czapar, MD/PhD (she/her/hers) – University of Chicago"
480,1498477,2:45 PM - 2:57 PM,"Let's Have a Chat: How Well Does an Artificial Intelligence Chatbot Answer Clinical Infectious Diseases Questions?Co-Author:  Kathleen Hanrahan, Pharm.D. – SUNY Upstate Medical UniversityCo-Author:  Jeffrey Steele, Pharm.D. – State University of New York Upstate University HospitalCo-Author:  Robert Seabury, Pharm.D. – SUNY Upstate University HospitalCo-Author:  Katie A. Parsels, Pharm.D., BCIDP – State University of New York Upstate Medical UniversityCo-Author:  Conan MacDougall, PharmD, MAS (he/him/his) – University of California San FranciscoCo-Author:  Rachel S. Britt, PharmD, BCIDP – The University of Texas Medical BranchCo-Author:  Elias Chahine, Pharm.D. – Palm Beach Atlantic University Gregory School of PharmacyCo-Author:  Elizabeth W. Covington, PharmD, BCIDP – Auburn University Harrison College of PharmacyCo-Author:  Jason C. Gallagher, PharmD – Temple UniversityPresenting Author:  Wesley D. Kufel, Pharm.D., BCPS, BCIDP – Binghamton University School of Pharmacy Sciences","Co-Author:  Kathleen Hanrahan, Pharm.D. – SUNY Upstate Medical UniversityCo-Author:  Jeffrey Steele, Pharm.D. – State University of New York Upstate University HospitalCo-Author:  Robert Seabury, Pharm.D. – SUNY Upstate University HospitalCo-Author:  Katie A. Parsels, Pharm.D., BCIDP – State University of New York Upstate Medical UniversityCo-Author:  Conan MacDougall, PharmD, MAS (he/him/his) – University of California San FranciscoCo-Author:  Rachel S. Britt, PharmD, BCIDP – The University of Texas Medical BranchCo-Author:  Elias Chahine, Pharm.D. – Palm Beach Atlantic University Gregory School of PharmacyCo-Author:  Elizabeth W. Covington, PharmD, BCIDP – Auburn University Harrison College of PharmacyCo-Author:  Jason C. Gallagher, PharmD – Temple UniversityPresenting Author:  Wesley D. Kufel, Pharm.D., BCPS, BCIDP – Binghamton University School of Pharmacy Sciences"
481,1498293,1:45 PM - 2:00 PM,"Impact of the infectious site infection with Staphylococcus aureus in Europe: results from the economics of the SALT studyPresenting Author:  Jon Salmanton-Garcia, MSc, PhD (he/him/his) – University Hospital Cologne, Cologne, GermanyCo-Author:  Caroline Bruns, n/a – University Hospital CologneCo-Author:  Jule Rutz, n/a – University Hospital CologneCo-Author:  Markus Albertsmeier, n/a – Ludwig-Maximilians-UniversitÃ¤t MunichCo-Author:  Juliane Ankert, n/a – University Hospital JenaCo-Author:  Louis Bernard, MD/PHD – CHU TOURSCo-Author:  Camille Bataille, n/a – UniversitÃ© LimogesCo-Author:  Elodie CouvÃ©-Deacon, n/a – UniversitÃ© LimogesCo-Author:  MarÃ­a FernÃ¡ndez-Ferrer, n/a – Universitat Pompeu FabraCo-Author:  JesÃºs FortÃºn, n/a – RamÃ³n y Cajal University HospitalCo-Author:  Alicia Galar, PharmD, PhD – Hospital General Universitario Gregorio MaraÃ±Ã³n. Clinical Microbiology and Infectious Diseases Department. Instituto de InvestigaciÃ³n Sanitaria Gregorio MaraÃ±Ã³nCo-Author:  Eva Grill, n/a – Ludwig-Maximilians-UniversitÃ¤t MunichCo-Author:  Thomas Guimard, MD – CHD VENDEECo-Author:  JÃ¶rg-Janne Vehreschild, n/a – University of CologneCo-Author:  Jannik Stemler, - – University Hospital CologneCo-Author:  Jan-Hendrik Naendrup, n/a – University of CologneCo-Author:  JÃ¼rgen Hampl, n/a – University of CologneCo-Author:  Bradly Tallon, n/a – Manchester University NHS Foundation TrustCo-Author:  Rosanne Sprute, Dr. – University Hospital CologneCo-Author:  Juan Pablo Horcajada, PhD, MD, Msc – Hospital del MarCo-Author:  Joan Mollar-Maseres, n/a – La Fe University and Polytechnic HospitalCo-Author:  Patricia MuÃ±oz, n/a – Hospital General Universitario Gregorio MaraÃ±Ã³nCo-Author:  Mathias Pletz, n/a – University Hospital JenaCo-Author:  Ferdinand Serracino-Inglott, n/a – Manchester University NHS Foundation TrustCo-Author:  Alex Soriano, MD – Hospital ClÃ­nic de BarcelonaCo-Author:  Tim Vilz, n/a – University Hospital BonnCo-Author:  Harald Seifert, MD – Institute for Medical Microbiology, Immunology and Hygiene, University of CologneCo-Author:  Oliver A. Cornely, Prof. Dr. – University of Cologne, Faculty of Medicine and University Hospital CologneCo-Author:  Sibylle Mellinghoff, MD – University Hospital of CologneCo-Author:  Blasius Liss, n/a – Helios University WuppertalCo-Author:  Sebastian Wingen-Heimann, n/a – University Hospital Cologne","Presenting Author:  Jon Salmanton-Garcia, MSc, PhD (he/him/his) – University Hospital Cologne, Cologne, GermanyCo-Author:  Caroline Bruns, n/a – University Hospital CologneCo-Author:  Jule Rutz, n/a – University Hospital CologneCo-Author:  Markus Albertsmeier, n/a – Ludwig-Maximilians-UniversitÃ¤t MunichCo-Author:  Juliane Ankert, n/a – University Hospital JenaCo-Author:  Louis Bernard, MD/PHD – CHU TOURSCo-Author:  Camille Bataille, n/a – UniversitÃ© LimogesCo-Author:  Elodie CouvÃ©-Deacon, n/a – UniversitÃ© LimogesCo-Author:  MarÃ­a FernÃ¡ndez-Ferrer, n/a – Universitat Pompeu FabraCo-Author:  JesÃºs FortÃºn, n/a – RamÃ³n y Cajal University HospitalCo-Author:  Alicia Galar, PharmD, PhD – Hospital General Universitario Gregorio MaraÃ±Ã³n. Clinical Microbiology and Infectious Diseases Department. Instituto de InvestigaciÃ³n Sanitaria Gregorio MaraÃ±Ã³nCo-Author:  Eva Grill, n/a – Ludwig-Maximilians-UniversitÃ¤t MunichCo-Author:  Thomas Guimard, MD – CHD VENDEECo-Author:  JÃ¶rg-Janne Vehreschild, n/a – University of CologneCo-Author:  Jannik Stemler, - – University Hospital CologneCo-Author:  Jan-Hendrik Naendrup, n/a – University of CologneCo-Author:  JÃ¼rgen Hampl, n/a – University of CologneCo-Author:  Bradly Tallon, n/a – Manchester University NHS Foundation TrustCo-Author:  Rosanne Sprute, Dr. – University Hospital CologneCo-Author:  Juan Pablo Horcajada, PhD, MD, Msc – Hospital del MarCo-Author:  Joan Mollar-Maseres, n/a – La Fe University and Polytechnic HospitalCo-Author:  Patricia MuÃ±oz, n/a – Hospital General Universitario Gregorio MaraÃ±Ã³nCo-Author:  Mathias Pletz, n/a – University Hospital JenaCo-Author:  Ferdinand Serracino-Inglott, n/a – Manchester University NHS Foundation TrustCo-Author:  Alex Soriano, MD – Hospital ClÃ­nic de BarcelonaCo-Author:  Tim Vilz, n/a – University Hospital BonnCo-Author:  Harald Seifert, MD – Institute for Medical Microbiology, Immunology and Hygiene, University of CologneCo-Author:  Oliver A. Cornely, Prof. Dr. – University of Cologne, Faculty of Medicine and University Hospital CologneCo-Author:  Sibylle Mellinghoff, MD – University Hospital of CologneCo-Author:  Blasius Liss, n/a – Helios University WuppertalCo-Author:  Sebastian Wingen-Heimann, n/a – University Hospital Cologne"
481,1498489,2:00 PM - 2:15 PM,"The Association Between Contact Precautions for Methicillin-resistant Staphylococcus aureus (MRSA) Colonization and MRSA Bloodstream Infection (BSI) Rates in Los Angeles County Hospitals: Results of a Countywide SurveyPresenting Author:  Pam Lee, MD – Harbor UCLACo-Author:  Kelsey OYong, MPH, CIC – Los Angeles County Department of Public HealthCo-Author:  Zachary A. Rubin, MD (he/him/his) – Los Angeles County Department of Public HealthCo-Author:  Loren G. Miller, MD MPH – Lundquist Institute at Harbor-UCLA Medical CenterCo-Author:  Deborah Kupferwasser, DrPH – Division of Infectious Diseases, the Lundquist Institute at Harbor-UCLA Medical Center, Torrance, CA","Presenting Author:  Pam Lee, MD – Harbor UCLACo-Author:  Kelsey OYong, MPH, CIC – Los Angeles County Department of Public HealthCo-Author:  Zachary A. Rubin, MD (he/him/his) – Los Angeles County Department of Public HealthCo-Author:  Loren G. Miller, MD MPH – Lundquist Institute at Harbor-UCLA Medical CenterCo-Author:  Deborah Kupferwasser, DrPH – Division of Infectious Diseases, the Lundquist Institute at Harbor-UCLA Medical Center, Torrance, CA"
481,1498485,2:15 PM - 2:30 PM,"Late Onset Invasive Group B Streptococcal Disease Outbreak in a Neonatal Intensive Care Unit Identified Through Whole Genome Sequencing â?? Connecticut, 2020â??2024Presenting Author:  Matthew C. Lambert, MD (he/him/his) – Centers for Disease ControlCo-Author:  Sydney Jones, PhD – Centers for Disease ControlCo-Author:  Kelly Mueller, RN – Connecticut Department of Public HealthCo-Author:  Meghan Maloney, MPH – Connecticut Department of Public HealthCo-Author:  Neranjan Perera, PhD – Connecticut Department of Public Health LaboratoryCo-Author:  Kutluhan Incekara, MS – Connecticut Department of Public Health LaboratoryCo-Author:  Susan Petit, MPH – Connecticut Department of Public HealthCo-Author:  Veena Ramachandran, MD, MPH – Centers for Disease ControlCo-Author:  Marissa Grossman, PhD, MPH – Centers for Disease Control and PreventionCo-Author:  Amy Valderrama, PhD, RN – Centers for Disease ControlCo-Author:  Sopio Chochua, MD. PhD. – CDCCo-Author:  Lesley McGee, PhD – Centers for Disease Control and PreventionCo-Author:  Benjamin Metcalf, PhD – Centers for Disease ControlCo-Author:  Stephanie Schrag, DPhil – CDCCo-Author:  Lynn Sosa, MD – Connecticut Department of Public Health","Presenting Author:  Matthew C. Lambert, MD (he/him/his) – Centers for Disease ControlCo-Author:  Sydney Jones, PhD – Centers for Disease ControlCo-Author:  Kelly Mueller, RN – Connecticut Department of Public HealthCo-Author:  Meghan Maloney, MPH – Connecticut Department of Public HealthCo-Author:  Neranjan Perera, PhD – Connecticut Department of Public Health LaboratoryCo-Author:  Kutluhan Incekara, MS – Connecticut Department of Public Health LaboratoryCo-Author:  Susan Petit, MPH – Connecticut Department of Public HealthCo-Author:  Veena Ramachandran, MD, MPH – Centers for Disease ControlCo-Author:  Marissa Grossman, PhD, MPH – Centers for Disease Control and PreventionCo-Author:  Amy Valderrama, PhD, RN – Centers for Disease ControlCo-Author:  Sopio Chochua, MD. PhD. – CDCCo-Author:  Lesley McGee, PhD – Centers for Disease Control and PreventionCo-Author:  Benjamin Metcalf, PhD – Centers for Disease ControlCo-Author:  Stephanie Schrag, DPhil – CDCCo-Author:  Lynn Sosa, MD – Connecticut Department of Public Health"
481,1498481,2:30 PM - 2:45 PM,"Impact of Universal Nasal Decolonization with an Alcohol-Based Nasal Antiseptic (ABNA) Versus Mupirocin on Infection Rates and Antimicrobial Utilization in Patients (Pts) Admitted to the Burn Service Co-Author:  Arefa Bacchus, PharmD – Atrium Health Wake Forest BaptistCo-Author:  Werner Bischoff, MD PhD (he/him/his) – Wake Forest  University School of MedicineCo-Author:  Mary Banoub, PharmD, BCIDP, CPP – Atrium Health Wake Forest Baptist Medical CenterCo-Author:  Olivia Randazza, PharmD – Atrium Health Wake Forest BaptistCo-Author:  Vera P. Luther, MD (she/her/hers) – Wake Forest University School of MedicineCo-Author:  James R. Beardsley, PharmD – Wake Forest University School of MedicineCo-Author:  John C. Williamson, PharmD – Atrium Health Wake Forest BaptistCo-Author:  Kristin Rebo, PharmD, BCCCP – Atrium Health Wake Forest HealthCo-Author:  Seth Garner, PharmD, BCCCP – Atrium Health Wake Forest Medical CenterCo-Author:  Michael E. DeWitt, MS – Atrium Wake Forest Baptist Health/ Wake Forest University School of MedicinePresenting Author:  Alex D. Taylor, PharmD (she/her/hers) – Atrium Health Wake Forest Baptist","Co-Author:  Arefa Bacchus, PharmD – Atrium Health Wake Forest BaptistCo-Author:  Werner Bischoff, MD PhD (he/him/his) – Wake Forest  University School of MedicineCo-Author:  Mary Banoub, PharmD, BCIDP, CPP – Atrium Health Wake Forest Baptist Medical CenterCo-Author:  Olivia Randazza, PharmD – Atrium Health Wake Forest BaptistCo-Author:  Vera P. Luther, MD (she/her/hers) – Wake Forest University School of MedicineCo-Author:  James R. Beardsley, PharmD – Wake Forest University School of MedicineCo-Author:  John C. Williamson, PharmD – Atrium Health Wake Forest BaptistCo-Author:  Kristin Rebo, PharmD, BCCCP – Atrium Health Wake Forest HealthCo-Author:  Seth Garner, PharmD, BCCCP – Atrium Health Wake Forest Medical CenterCo-Author:  Michael E. DeWitt, MS – Atrium Wake Forest Baptist Health/ Wake Forest University School of MedicinePresenting Author:  Alex D. Taylor, PharmD (she/her/hers) – Atrium Health Wake Forest Baptist"
481,1498476,2:45 PM - 3:00 PM,"The Agency for Healthcare Research and Quality (AHRQ) Safety Program for MRSA Prevention: Impact of an Educational and Implementation Project in United States (US) HospitalsPresenting Author:  Lisa L. Maragakis, MD, MPH (she/her/hers) – Johns Hopkins MedicineCo-Author:  Melissa A. Miller, MD, MS – Agency for Healthcare Research and QualityCo-Author:  Leyi Lin, MD – Agency for Healthcare Research and QualityCo-Author:  Roy Ahn, MPH, ScD – NORCCo-Author:  Kathleen Speck, MPH – Johns HopkinsCo-Author:  Yue Gao, MPH – NORCCo-Author:  Jennifer Titus, MPH – NORC at the University of ChicagoCo-Author:  Prashila Dullabh, MD – NORC at the University of Chicago","Presenting Author:  Lisa L. Maragakis, MD, MPH (she/her/hers) – Johns Hopkins MedicineCo-Author:  Melissa A. Miller, MD, MS – Agency for Healthcare Research and QualityCo-Author:  Leyi Lin, MD – Agency for Healthcare Research and QualityCo-Author:  Roy Ahn, MPH, ScD – NORCCo-Author:  Kathleen Speck, MPH – Johns HopkinsCo-Author:  Yue Gao, MPH – NORCCo-Author:  Jennifer Titus, MPH – NORC at the University of ChicagoCo-Author:  Prashila Dullabh, MD – NORC at the University of Chicago"
482,1498292,1:45 PM - 2:00 PM,"Immunogenicity and Safety of High-dose versus Double-dose Quadrivalent Inactivated Influenza Vaccine in Adult Kidney Transplant Recipients: A Randomized Controlled TrialPresenting Author:  Thanachote Arayanumas, MD (he/him/his) – Faculty of Medicine Ramathibodi Hospital, Mahidol UniversityCo-Author:  Kobporn Boonnak, Ph.D. – Faculty of Medicine Siriraj Hospital, Mahidol UniversityCo-Author:  Surasak Kantachuvesiri, MD – Faculty of Medicine Ramathibody Hospital, Mahidol UniversityCo-Author:  Sarinya Boongird, MD – Faculty of Medicine Ramathibodi Hospital, Mahidol UniversityCo-Author:  Sasisopin Kiertiburanakul, MD MHS – Faculty of Medicine Ramathibodi HospitalCo-Author:  Jackrapong Bruminhent, MD, FIDSA – Faculty of Medicine Ramathibodi Hospital, Mahidol University","Presenting Author:  Thanachote Arayanumas, MD (he/him/his) – Faculty of Medicine Ramathibodi Hospital, Mahidol UniversityCo-Author:  Kobporn Boonnak, Ph.D. – Faculty of Medicine Siriraj Hospital, Mahidol UniversityCo-Author:  Surasak Kantachuvesiri, MD – Faculty of Medicine Ramathibody Hospital, Mahidol UniversityCo-Author:  Sarinya Boongird, MD – Faculty of Medicine Ramathibodi Hospital, Mahidol UniversityCo-Author:  Sasisopin Kiertiburanakul, MD MHS – Faculty of Medicine Ramathibodi HospitalCo-Author:  Jackrapong Bruminhent, MD, FIDSA – Faculty of Medicine Ramathibodi Hospital, Mahidol University"
482,1498488,2:00 PM - 2:15 PM,"Randomized, Double-Blinded, Placebo-Controlled, Phase 1 Study of the Safety of BPL-1357, A BPL-Inactivated, Whole-Virus, Universal Influenza VaccinePresenting Author:  Luca Tudor Giurgea, MD – National Institute of Allergy and Infectious DiseasesCo-Author:  Alison Han, MD, MS – National Institutes of HealthCo-Author:  Lindsay Czajkowski, MSN, NP-C – National Institute of Allergy and Infectious DiseasesCo-Author:  Holly Ann Baus, RN, MSN – National Institute of Allergy and Infectious DiseasesCo-Author:  Gregory Mak, MD, MPH – LID Clinical Studies Unit, Laboratory of Infectious Diseases, Division of Intramural Research, National Institute of Allergy and Infectious Diseases, National Institutes of HealthCo-Author:  Kimberly Adao, RN, BSN – LID Clinical Studies Unit, Laboratory of Infectious Diseases, Division of Intramural Research, National Institute of Allergy and Infectious Diseases, National Institutes of HealthCo-Author:  Ian Bellayr, PhD – Laboratory of Infectious Diseases, National Institute of Allergy and Infectious Diseases, National Institutes of HealthCo-Author:  Adriana Cervantes-Medina, BS – National Institute of Allergy and Infectious DiseasesCo-Author:  Monica Gouzoulis, BS – LID Clinical Studies Unit, Laboratory of Infectious Diseases, Division of Intramural Research, National Institute of Allergy and Infectious Diseases, National Institutes of HealthCo-Author:  Jenna Sherry, MS – LID Clinical Studies Unit, Laboratory of Infectious Diseases, Division of Intramural Research, National Institute of Allergy and Infectious Diseases, National Institutes of HealthCo-Author:  Rani Athota, PhD – National Institute of Allergy and Infectious DiseasesCo-Author:  Viviane Callier, PhD – Frederick National Laboratory for Cancer ResearchCo-Author:  Sally Hunsberger, PhD – National Institute of Allergy and Infectious DiseasesCo-Author:  Jaekeun Park, DVM, PhD – Department of Veterinary Medicine, VA-MD College of Veterinary Medicine, University of MarylandCo-Author:  Jeffery Taubenberger, MD, PhD – National Institute of Allergy and Infectious DiseasesCo-Author:  Matthew J. Memoli, MD, MS – National Institute of Allergy and Infectious Diseases","Presenting Author:  Luca Tudor Giurgea, MD – National Institute of Allergy and Infectious DiseasesCo-Author:  Alison Han, MD, MS – National Institutes of HealthCo-Author:  Lindsay Czajkowski, MSN, NP-C – National Institute of Allergy and Infectious DiseasesCo-Author:  Holly Ann Baus, RN, MSN – National Institute of Allergy and Infectious DiseasesCo-Author:  Gregory Mak, MD, MPH – LID Clinical Studies Unit, Laboratory of Infectious Diseases, Division of Intramural Research, National Institute of Allergy and Infectious Diseases, National Institutes of HealthCo-Author:  Kimberly Adao, RN, BSN – LID Clinical Studies Unit, Laboratory of Infectious Diseases, Division of Intramural Research, National Institute of Allergy and Infectious Diseases, National Institutes of HealthCo-Author:  Ian Bellayr, PhD – Laboratory of Infectious Diseases, National Institute of Allergy and Infectious Diseases, National Institutes of HealthCo-Author:  Adriana Cervantes-Medina, BS – National Institute of Allergy and Infectious DiseasesCo-Author:  Monica Gouzoulis, BS – LID Clinical Studies Unit, Laboratory of Infectious Diseases, Division of Intramural Research, National Institute of Allergy and Infectious Diseases, National Institutes of HealthCo-Author:  Jenna Sherry, MS – LID Clinical Studies Unit, Laboratory of Infectious Diseases, Division of Intramural Research, National Institute of Allergy and Infectious Diseases, National Institutes of HealthCo-Author:  Rani Athota, PhD – National Institute of Allergy and Infectious DiseasesCo-Author:  Viviane Callier, PhD – Frederick National Laboratory for Cancer ResearchCo-Author:  Sally Hunsberger, PhD – National Institute of Allergy and Infectious DiseasesCo-Author:  Jaekeun Park, DVM, PhD – Department of Veterinary Medicine, VA-MD College of Veterinary Medicine, University of MarylandCo-Author:  Jeffery Taubenberger, MD, PhD – National Institute of Allergy and Infectious DiseasesCo-Author:  Matthew J. Memoli, MD, MS – National Institute of Allergy and Infectious Diseases"
482,1498484,2:15 PM - 2:30 PM,"A Phase I, Multicenter, Randomized, Double-blind, Placebo-controlled Single Dose, Dose-ranging Study to Evaluate the Safety, Tolerability, and Immunogenicity of Orally Administered Bivalent GI.1/GII.4 Norovirus Vaccine in Healthy Lactating Females â?¥ 18 years Old and Their Breast-feeding InfantsPresenting Author:  Lam Nguyen, MD (she/her/hers) – Vaxart IncCo-Author:  Susan Greco, MD, MPH – Vaxart, IncCo-Author:  Becca A. Flitter, PhD, MPH – Vaxart IncCo-Author:  Molly Braun, PhD – Vaxart, IncCo-Author:  Nicholas Dâ??Amato, MSc. – VaxartCo-Author:  Sean N. Tucker, PhD – VaxartCo-Author:  James F. Cummings, MD – VAXARTCo-Author:  Colin A. Lester, n/a – Vaxart, Inc.Co-Author:  Darreann Carmela Hailey, MS – Vaxart, Inc.","Presenting Author:  Lam Nguyen, MD (she/her/hers) – Vaxart IncCo-Author:  Susan Greco, MD, MPH – Vaxart, IncCo-Author:  Becca A. Flitter, PhD, MPH – Vaxart IncCo-Author:  Molly Braun, PhD – Vaxart, IncCo-Author:  Nicholas Dâ??Amato, MSc. – VaxartCo-Author:  Sean N. Tucker, PhD – VaxartCo-Author:  James F. Cummings, MD – VAXARTCo-Author:  Colin A. Lester, n/a – Vaxart, Inc.Co-Author:  Darreann Carmela Hailey, MS – Vaxart, Inc."
482,1498480,2:30 PM - 2:45 PM,"The Effect of Herpes Zoster Vaccination on New Diagnoses of Dementia: A Quasi-randomized Study in AustraliaCo-Author:  Michael Pomirchy, PhD – Stanford UniversityCo-Author:  Christian Bommer, PhD – Stanford UniversityPresenting Author:  Pascal Geldsetzer, MD PhD MPH (he/him/his) – Stanford University","Co-Author:  Michael Pomirchy, PhD – Stanford UniversityCo-Author:  Christian Bommer, PhD – Stanford UniversityPresenting Author:  Pascal Geldsetzer, MD PhD MPH (he/him/his) – Stanford University"
