Id,Pres ID,time,title,presenter
402,1411111,3:40 PM - 4:05 PM,"PrEP and Treatment of HIV in LATAMSpeaker:  Valdilea Goncalves Veloso, PhD (she/her/hers) – Oswaldo Cruz Foundation","Speaker:  Valdilea Goncalves Veloso, PhD (she/her/hers) – Oswaldo Cruz Foundation"
402,1411112,4:05 PM - 4:30 PM,"Emerging STIs in The CaribbeanSpeaker:  Robert Paulino-RamÃ­rez, MSc, MPH, DTM&H (he/him/his) – Universidad Iberoamericana (UNIBE)","Speaker:  Robert Paulino-RamÃ­rez, MSc, MPH, DTM&H (he/him/his) – Universidad Iberoamericana (UNIBE)"
403,1408065,3:15 PM - 3:40 PM,"Working with Surgical Teams to Support StewardshipSpeaker:  Robert G. Sawyer, MD – Western Michigan Homer Stryker M.D. School of Medicine","Speaker:  Robert G. Sawyer, MD – Western Michigan Homer Stryker M.D. School of Medicine"
403,1408063,3:40 PM - 4:05 PM,"Targeting Tough Transplant Cases for Antimicrobial StewardshipSpeaker:  Dayna McManus, PharmD, BCPS, BCIDP – Yale New Haven Hospital","Speaker:  Dayna McManus, PharmD, BCPS, BCIDP – Yale New Haven Hospital"
403,1408064,4:05 PM - 4:30 PM,"Evaluating the Evidence for Antimicrobial Stewardship in the OB/GYN PopulationSpeaker:  Casey Smiley, MD (she/her/hers) – Vanderbilt University Medical Center","Speaker:  Casey Smiley, MD (she/her/hers) – Vanderbilt University Medical Center"
404,1408112,3:15 PM - 3:40 PM,"COVID-19 in Children:  the Current Landscape in the midst of Vaccine HesitancySpeaker:  IJ Anosike, MD, MPH  (she/her/hers) – Montefiore Medical Center/ Childrenâ??s Hospital at Montefiore","Speaker:  IJ Anosike, MD, MPH  (she/her/hers) – Montefiore Medical Center/ Childrenâ??s Hospital at Montefiore"
404,1408111,3:40 PM - 4:05 PM,"Pediatric Enteroviruses: Infections from Head to ToeSpeaker:  Hai D. Nguyen-Tran, MD (she/her/hers) – University of Colorado/Children's Hospital Colorado","Speaker:  Hai D. Nguyen-Tran, MD (she/her/hers) – University of Colorado/Children's Hospital Colorado"
404,1408113,4:05 PM - 4:30 PM,"Adenovirus Infections within the United States: Surveillance and OutbreaksSpeaker:  Hannah L. Kirking, MD – Coronavirus and Other Respiratory Viruses Division, National Center for Immunization and Respiratory Diseases, CDC","Speaker:  Hannah L. Kirking, MD – Coronavirus and Other Respiratory Viruses Division, National Center for Immunization and Respiratory Diseases, CDC"
405,1498336,3:15 PM - 3:30 PM,"Culture Clash: A Comparison of Approach to Blood Culture Diagnostic Stewardship across 3 Emergency Departments in a Healthcare NetworkCo-Author:  Rebecca Theophanous, MD – Duke University School of MedicineCo-Author:  Rebekah W. Moehring, MD, MPH, FIDSA, FSHEA (she/her/hers) – Duke UniversityPresenting Author:  Erin Gettler, MD (she/her/hers) – Duke University Medical CenterCo-Author:  Timothy Plonk, MD – Duke UniversityCo-Author:  Jessica Michal, PharmD, BCIDP, AAHIVP – Duke Raleigh HospitalCo-Author:  Kendall Conger, MD – Duke UniversityCo-Author:  Rebekah Wrenn, PharmD – Duke University Co-Author:  Jessica Seidelman, MD, MPH (she/her/hers) – Duke University School of Medicine","Co-Author:  Rebecca Theophanous, MD – Duke University School of MedicineCo-Author:  Rebekah W. Moehring, MD, MPH, FIDSA, FSHEA (she/her/hers) – Duke UniversityPresenting Author:  Erin Gettler, MD (she/her/hers) – Duke University Medical CenterCo-Author:  Timothy Plonk, MD – Duke UniversityCo-Author:  Jessica Michal, PharmD, BCIDP, AAHIVP – Duke Raleigh HospitalCo-Author:  Kendall Conger, MD – Duke UniversityCo-Author:  Rebekah Wrenn, PharmD – Duke University Co-Author:  Jessica Seidelman, MD, MPH (she/her/hers) – Duke University School of Medicine"
405,1498332,3:30 PM - 3:45 PM,"Optimizing Blood Culture Utilization in Solid Organ Transplant Recipients: A Diagnostic Stewardship ApproachPresenting Author:  Julie M. Steinbrink, MD, MHS – Duke UniversityCo-Author:  Nitin Mehdiratta, MD, CPPS – Duke University HospitalCo-Author:  Heather E. Pena, MSN, RN, CCRN, CPPS – Duke University HospitalCo-Author:  Ian Welsby, MD – Duke University Co-Author:  Jessica Seidelman, MD, MPH (she/her/hers) – Duke University School of MedicineCo-Author:  Manuela Carugati, MD (she/her/hers) – Duke University","Presenting Author:  Julie M. Steinbrink, MD, MHS – Duke UniversityCo-Author:  Nitin Mehdiratta, MD, CPPS – Duke University HospitalCo-Author:  Heather E. Pena, MSN, RN, CCRN, CPPS – Duke University HospitalCo-Author:  Ian Welsby, MD – Duke University Co-Author:  Jessica Seidelman, MD, MPH (she/her/hers) – Duke University School of MedicineCo-Author:  Manuela Carugati, MD (she/her/hers) – Duke University"
405,1498328,3:45 PM - 4:00 PM,"Impact of clinical diagnostic stewardship of respiratory cultures across a multicenter PICU collaborativePresenting Author:  Anna Sick-Samuels, MD, MPH – Johns Hopkins UniversityCo-Author:  Daniel Kelly, MD, MHQS – Boston Children's HosptialCo-Author:  Charlotte Woods-Hill, MD, MSHP – Children's Hospital of PhiladelphiaCo-Author:  Abigail Arthur, MD, MPH – Johns Hopkins University School of MedicineCo-Author:  Urmi Kumar, MPH – Johns Hopkins University School of MedicineCo-Author:  Danielle W. Koontz, MAS – JHU SOMCo-Author:  Anping Xie PhD, PhD – Johns Hopkins UniversityCo-Author:  Jill A. Marsteller, PhD, MPP – Johns Hopkins Bloomberg School of Public HealthCo-Author:  Shaoming Xiao, MSPH – Johns Hopkins UniversityCo-Author:  Elizabeth Colantuoni, PhD – Johns HopkinsCo-Author:  Aaron Milstone, MD, MHS (he/him/his) – Johns Hopkins University","Presenting Author:  Anna Sick-Samuels, MD, MPH – Johns Hopkins UniversityCo-Author:  Daniel Kelly, MD, MHQS – Boston Children's HosptialCo-Author:  Charlotte Woods-Hill, MD, MSHP – Children's Hospital of PhiladelphiaCo-Author:  Abigail Arthur, MD, MPH – Johns Hopkins University School of MedicineCo-Author:  Urmi Kumar, MPH – Johns Hopkins University School of MedicineCo-Author:  Danielle W. Koontz, MAS – JHU SOMCo-Author:  Anping Xie PhD, PhD – Johns Hopkins UniversityCo-Author:  Jill A. Marsteller, PhD, MPP – Johns Hopkins Bloomberg School of Public HealthCo-Author:  Shaoming Xiao, MSPH – Johns Hopkins UniversityCo-Author:  Elizabeth Colantuoni, PhD – Johns HopkinsCo-Author:  Aaron Milstone, MD, MHS (he/him/his) – Johns Hopkins University"
405,1498324,4:00 PM - 4:15 PM,"Should We Be Doing This? Evaluating Pleural Fluid Inoculation into Blood Culture Bottles.Presenting Author:  J. Hunter Fraker, MD (he/him/his) – Beth Israel Deaconess Medical CenterCo-Author:  Matthew S. Lee, M.D. – Beth Israel Deaconess Medical Center","Presenting Author:  J. Hunter Fraker, MD (he/him/his) – Beth Israel Deaconess Medical CenterCo-Author:  Matthew S. Lee, M.D. – Beth Israel Deaconess Medical Center"
405,1498318,4:15 PM - 4:30 PM,"Comparing the Effects of Commercial to Manual Initial Specimen Diversion Techniques (ISDT) on Clinical Outcomes and Institutional CostsPresenting Author:  Erin H. Yang, MD – Baylor College of MedicineCo-Author:  Corina Lopez, M.D. – Baylor College of MedicineCo-Author:  Sabra Shay, BSN, MPH – PremierCo-Author:  Margaret Reed, n/a – Baylor St. Lukes Medical CenterCo-Author:  Victoria McArdle, n/a – Baylor St. Lukes Medical CenterCo-Author:  Todd M. Lasco, PhD – Baylor St. Luke's Medical CenterCo-Author:  Mayar Al Mohajer, MD, MBA, MPH (he/him/his) – Baylor College of Medicine","Presenting Author:  Erin H. Yang, MD – Baylor College of MedicineCo-Author:  Corina Lopez, M.D. – Baylor College of MedicineCo-Author:  Sabra Shay, BSN, MPH – PremierCo-Author:  Margaret Reed, n/a – Baylor St. Lukes Medical CenterCo-Author:  Victoria McArdle, n/a – Baylor St. Lukes Medical CenterCo-Author:  Todd M. Lasco, PhD – Baylor St. Luke's Medical CenterCo-Author:  Mayar Al Mohajer, MD, MBA, MPH (he/him/his) – Baylor College of Medicine"
406,1498335,3:15 PM - 3:30 PM,"Changing Epidemiology of Pediatric Invasive Group A Streptococcus Infections in the United States, 2004-2022Presenting Author:  Veena Ramachandran, MD, MPH – Centers for Disease ControlCo-Author:  Jennifer Okaro, MPH – Centers for Disease Control and PreventionCo-Author:  Lesley McGee, PhD – Centers for Disease Control and PreventionCo-Author:  Christopher Gregory, MD – Centers for Disease Control and PreventionCo-Author:  Bridget J. Anderson, PhD – New York State Department of HealthCo-Author:  Lee Harrison, MD – University of PittsburghCo-Author:  Jessica Houston, MPH – New Mexico Department of HealthCo-Author:  Ruth Lynfield, MD (she/her/hers) – Minnesota Department of HealthCo-Author:  Erin Youngkin, MPH – Colorado Department of Public Health and EnvironmentCo-Author:  Amy Tunali, MPH – Georgia Emerging Infections ProgramCo-Author:  Ann Thomas, MD – Public Health Division, Oregon Health AuthorityCo-Author:  William Schaffner, MD – Vanderbilt University Medical CenterCo-Author:  Susan Petit, MPH – Connecticut Department of Public HealthCo-Author:  Shua Chai, MD, MPH – California Department of Public Health","Presenting Author:  Veena Ramachandran, MD, MPH – Centers for Disease ControlCo-Author:  Jennifer Okaro, MPH – Centers for Disease Control and PreventionCo-Author:  Lesley McGee, PhD – Centers for Disease Control and PreventionCo-Author:  Christopher Gregory, MD – Centers for Disease Control and PreventionCo-Author:  Bridget J. Anderson, PhD – New York State Department of HealthCo-Author:  Lee Harrison, MD – University of PittsburghCo-Author:  Jessica Houston, MPH – New Mexico Department of HealthCo-Author:  Ruth Lynfield, MD (she/her/hers) – Minnesota Department of HealthCo-Author:  Erin Youngkin, MPH – Colorado Department of Public Health and EnvironmentCo-Author:  Amy Tunali, MPH – Georgia Emerging Infections ProgramCo-Author:  Ann Thomas, MD – Public Health Division, Oregon Health AuthorityCo-Author:  William Schaffner, MD – Vanderbilt University Medical CenterCo-Author:  Susan Petit, MPH – Connecticut Department of Public HealthCo-Author:  Shua Chai, MD, MPH – California Department of Public Health"
406,1498331,3:30 PM - 3:45 PM,"Immunization Impact on Serotype Distribution of Invasive Pneumococcal Disease - Playing the Serotype Whack-A-Mole!Presenting Author:  Delma J. Nieves, MD – CHOC Children's HospitalCo-Author:  Stephanie Osborne, RN – Children's Hospital of Orange CountyCo-Author:  Michele Cheung, MD, MPH – Orange County Health Care AgencyCo-Author:  Matt Zahn, MD – Orange County Health Care AgencyCo-Author:  Antonio C. Arrieta, MD, FIDSA, FPIDS – Children's Hospital of Orange County","Presenting Author:  Delma J. Nieves, MD – CHOC Children's HospitalCo-Author:  Stephanie Osborne, RN – Children's Hospital of Orange CountyCo-Author:  Michele Cheung, MD, MPH – Orange County Health Care AgencyCo-Author:  Matt Zahn, MD – Orange County Health Care AgencyCo-Author:  Antonio C. Arrieta, MD, FIDSA, FPIDS – Children's Hospital of Orange County"
406,1498327,3:45 PM - 4:00 PM,"Acute Rheumatic Fever at a US Children's Hospital During a Period of Fluctuating Group A Streptococcus IncidencePresenting Author:  Jonathon C. McNeil, MD (he/him/his) – Baylor College of MedicineCo-Author:  Richard Bui – Baylor College of MedicineCo-Author:  Tam Doan, MD – Baylor College of MedicineCo-Author:  Marietta DeGuzman, MD – Baylor COMCo-Author:  Misu A. Sanson, MD, PhD – McGovern Medical SchoolCo-Author:  Anthony R. Flores, MD, MPH, PhD (he/him/his) – Vanderbilt University Medical CenterCo-Author:  Lauren M. Sommer, MS – Baylor College of Medicine","Presenting Author:  Jonathon C. McNeil, MD (he/him/his) – Baylor College of MedicineCo-Author:  Richard Bui – Baylor College of MedicineCo-Author:  Tam Doan, MD – Baylor College of MedicineCo-Author:  Marietta DeGuzman, MD – Baylor COMCo-Author:  Misu A. Sanson, MD, PhD – McGovern Medical SchoolCo-Author:  Anthony R. Flores, MD, MPH, PhD (he/him/his) – Vanderbilt University Medical CenterCo-Author:  Lauren M. Sommer, MS – Baylor College of Medicine"
406,1498323,4:00 PM - 4:15 PM,"Household Economic Burden and Social Consequences of Childhood Severe Pneumonia in India: A Cost of Illness based Pharmacoeconomic AnalysisPresenting Author:  Maria Tom, Pharm D – St. Joseph's College of Pharmacy, CherthalaCo-Author:  Jomel Raju, Pharm D – St. Joseph's College of Pharmacy, Cherthala","Presenting Author:  Maria Tom, Pharm D – St. Joseph's College of Pharmacy, CherthalaCo-Author:  Jomel Raju, Pharm D – St. Joseph's College of Pharmacy, Cherthala"
406,1498317,4:15 PM - 4:30 PM,"Mirror Mirror on the Wall Who is Driving all the Invasive GAS After All - The Utah ExperiencePresenting Author:  Benjamin McMillion, DO (he/him/his) – University of Utah School of MedicineCo-Author:  Nicole L. Pershing, MD, PhD – University of Utah School of MedicineCo-Author:  Hillary Crandall, MD, PhD – University of Utah School of MedicineCo-Author:  Adam Hersh, MD, PhD – University of Utah School of MedicineCo-Author:  Krow Ampofo, MBChB (he/him/his) – University of UtahCo-Author:  Jared Olson, PharmD – Primary Children's HospitalCo-Author:  Kelly F. Oakeson, Ph.D. – Utah Department of Health & Human Services / Utah Public Health LaboratoryCo-Author:  Jennifer M. Wagner, Master's Degree – Utah Department of Health and Human ServicesCo-Author:  Shannon Nielsen, BS – University of Utah School of MedicineCo-Author:  Mandy Dickey, BSc – Primary Children's HospitalCo-Author:  Kelly Huynh, MStat – Intermountain HealthCo-Author:  Andrew T. Pavia, MD – University of UtahCo-Author:  Anne J. Blaschke, MD, PhD (she/her/hers) – University of Utah School of Medicine","Presenting Author:  Benjamin McMillion, DO (he/him/his) – University of Utah School of MedicineCo-Author:  Nicole L. Pershing, MD, PhD – University of Utah School of MedicineCo-Author:  Hillary Crandall, MD, PhD – University of Utah School of MedicineCo-Author:  Adam Hersh, MD, PhD – University of Utah School of MedicineCo-Author:  Krow Ampofo, MBChB (he/him/his) – University of UtahCo-Author:  Jared Olson, PharmD – Primary Children's HospitalCo-Author:  Kelly F. Oakeson, Ph.D. – Utah Department of Health & Human Services / Utah Public Health LaboratoryCo-Author:  Jennifer M. Wagner, Master's Degree – Utah Department of Health and Human ServicesCo-Author:  Shannon Nielsen, BS – University of Utah School of MedicineCo-Author:  Mandy Dickey, BSc – Primary Children's HospitalCo-Author:  Kelly Huynh, MStat – Intermountain HealthCo-Author:  Andrew T. Pavia, MD – University of UtahCo-Author:  Anne J. Blaschke, MD, PhD (she/her/hers) – University of Utah School of Medicine"
407,1498338,3:15 PM - 3:27 PM,"SARS-CoV-2 Positivity and Genetic Relationships among Cases within Households in the Cascadia Prospective Cohort Study, July 2022 to May 2023Presenting Author:  Amanda M. Casto, MD/PhD – University of WashingtonCo-Author:  Tara M. Babu, MD, MSCI (she/her/hers) – University of WashingtonCo-Author:  Sarah N. Cox, PhD, MSPH (she/her/hers) – University of WashingtonCo-Author:  Collrane J. Frivold, MSPH – University of WashingtonCo-Author:  Julia C. Bennett, MPSH – University of WashingtonCo-Author:  Allison L. Naleway, PhD – Kaiser Permanente Center for Health ResearchCo-Author:  Mark A. Schmidt, PhD, MPH (he/him/his) – Center for Health Research, Kaiser Permanente NorthwestCo-Author:  Jennifer L. Kuntz, MS, PhD – Kaiser Permanente Center for Health ResearchCo-Author:  Cassandra Boisvert, MS – Kaiser PermanenteCo-Author:  Stephen P. Fortmann, MD – Kaiser PermanenteCo-Author:  Holly C. Groom, MPH – Kaiser Permanente Center for Health ResearchCo-Author:  Richard A. Mularski, MD, MSHS, MCR – 1.	Kaiser Permanente Center for Health Research, Portland, OregonCo-Author:  Sacha L. Reich, BA – Kaiser Permanente Center for Health ResearchCo-Author:  Neil D. Yetz, M.P.H. – Kaiser Permanente Center for Health ResearchCo-Author:  Leora R. Feldstein, PhD, MSc (she/her/hers) – Centers for Disease Control and PreventionCo-Author:  Claire Midgley, PhD, MSc (she/her/hers) – Centers for Disease Control and PreventionCo-Author:  Melissa Briggs-Hagen, MD, MPH – Centers for Disease Control and PreventionCo-Author:  Madison R. Hollcroft, MPH – University of Washington School of MedicineCo-Author:  Devon McDonald, BS – University of WashingtonCo-Author:  Mark Drummond, BS – University of WashingtonCo-Author:  Melissa P. MacMillan, BA, BS – University of WashingtonCo-Author:  Peter D. Han, M.S. – University of WashingtonCo-Author:  Zack Acker, MSCM – Brotman Baty Institute for Precision MedicineCo-Author:  Sally Grindstaff, MS – Brotman Baty InstituteCo-Author:  Luis Gamboa, BS – Brotman Baty Institute for Precision MedicineCo-Author:  Jeremy Stone, AB – Brotman Baty Institute, University of WashingtonCo-Author:  Ben Capodanno, BA – Brotman Baty InstituteCo-Author:  Kathryn McCaffrey, BA – Brotman Baty InstituteCo-Author:  Brenna Ehmen, MS – Brotman Baty InstituteCo-Author:  Lani Regelbrugge, B.S. – Brotman Baty InstituteCo-Author:  Natalie K. Lo, MPH, OTR – University of WashingtonCo-Author:  Lea Starita, PhD – University of WashingtonCo-Author:  Christina Lockwood, PhD – University of WashingtonCo-Author:  Janet A. Englund, MD – Seattle Childrenâ??s HospitalCo-Author:  Marco Carone, PhD – University of WashingtonCo-Author:  Ana A. Weil, MD, MPH – University of WashingtonCo-Author:  Helen Y. Chu, MD, MPH – University of Washington","Presenting Author:  Amanda M. Casto, MD/PhD – University of WashingtonCo-Author:  Tara M. Babu, MD, MSCI (she/her/hers) – University of WashingtonCo-Author:  Sarah N. Cox, PhD, MSPH (she/her/hers) – University of WashingtonCo-Author:  Collrane J. Frivold, MSPH – University of WashingtonCo-Author:  Julia C. Bennett, MPSH – University of WashingtonCo-Author:  Allison L. Naleway, PhD – Kaiser Permanente Center for Health ResearchCo-Author:  Mark A. Schmidt, PhD, MPH (he/him/his) – Center for Health Research, Kaiser Permanente NorthwestCo-Author:  Jennifer L. Kuntz, MS, PhD – Kaiser Permanente Center for Health ResearchCo-Author:  Cassandra Boisvert, MS – Kaiser PermanenteCo-Author:  Stephen P. Fortmann, MD – Kaiser PermanenteCo-Author:  Holly C. Groom, MPH – Kaiser Permanente Center for Health ResearchCo-Author:  Richard A. Mularski, MD, MSHS, MCR – 1.	Kaiser Permanente Center for Health Research, Portland, OregonCo-Author:  Sacha L. Reich, BA – Kaiser Permanente Center for Health ResearchCo-Author:  Neil D. Yetz, M.P.H. – Kaiser Permanente Center for Health ResearchCo-Author:  Leora R. Feldstein, PhD, MSc (she/her/hers) – Centers for Disease Control and PreventionCo-Author:  Claire Midgley, PhD, MSc (she/her/hers) – Centers for Disease Control and PreventionCo-Author:  Melissa Briggs-Hagen, MD, MPH – Centers for Disease Control and PreventionCo-Author:  Madison R. Hollcroft, MPH – University of Washington School of MedicineCo-Author:  Devon McDonald, BS – University of WashingtonCo-Author:  Mark Drummond, BS – University of WashingtonCo-Author:  Melissa P. MacMillan, BA, BS – University of WashingtonCo-Author:  Peter D. Han, M.S. – University of WashingtonCo-Author:  Zack Acker, MSCM – Brotman Baty Institute for Precision MedicineCo-Author:  Sally Grindstaff, MS – Brotman Baty InstituteCo-Author:  Luis Gamboa, BS – Brotman Baty Institute for Precision MedicineCo-Author:  Jeremy Stone, AB – Brotman Baty Institute, University of WashingtonCo-Author:  Ben Capodanno, BA – Brotman Baty InstituteCo-Author:  Kathryn McCaffrey, BA – Brotman Baty InstituteCo-Author:  Brenna Ehmen, MS – Brotman Baty InstituteCo-Author:  Lani Regelbrugge, B.S. – Brotman Baty InstituteCo-Author:  Natalie K. Lo, MPH, OTR – University of WashingtonCo-Author:  Lea Starita, PhD – University of WashingtonCo-Author:  Christina Lockwood, PhD – University of WashingtonCo-Author:  Janet A. Englund, MD – Seattle Childrenâ??s HospitalCo-Author:  Marco Carone, PhD – University of WashingtonCo-Author:  Ana A. Weil, MD, MPH – University of WashingtonCo-Author:  Helen Y. Chu, MD, MPH – University of Washington"
407,1498334,3:27 PM - 3:39 PM,"Revealing Seasonal Patterns in the Post-Pandemic Era: A Comparative Analysis of Burden and Seasonality of Influenza and COVID-19 in Europe and the US.Presenting Author:  Nabila Shaikh, MSc – SanofiCo-Author:  Robertus van Aalst, PhD, MSc – Sanofi VaccinesCo-Author:  Rebecca C Harris, MBioch, MSc, PhD – SanofiCo-Author:  Clotilde El Guerche-SÃ©blain, PhD – Sanofi vaccines","Presenting Author:  Nabila Shaikh, MSc – SanofiCo-Author:  Robertus van Aalst, PhD, MSc – Sanofi VaccinesCo-Author:  Rebecca C Harris, MBioch, MSc, PhD – SanofiCo-Author:  Clotilde El Guerche-SÃ©blain, PhD – Sanofi vaccines"
407,1498330,3:39 PM - 3:51 PM,"Effectiveness of Updated (2023-2024) Monovalent COVID-19 Vaccines â?? VISION Network, September 2023-March 2024Presenting Author:  Ruth Link-Gelles, PhD, MPH – Centers for Disease Control and PreventionCo-Author:  Elizabeth Rowley, DrPH – WestatCo-Author:  Sarah E. Reese, PhD – WestatCo-Author:  Omobosola Akinsete, MD – HealthPartners InstituteCo-Author:  Kristin K. Dascomb, MD. PhD – Intermountain HealthcareCo-Author:  Stephanie Irving, MHS (she/her/hers) – Kaiser Permanente Center for Health ResearchCo-Author:  Nicola P. Klein, MD, PhD (she/her/hers) – Division of Research Kaiser Permanente Vaccine Study CenterCo-Author:  Shaun J. Grannis, MD, MS – Indiana UniversityCo-Author:  Toan Ong, PhD – University of Colorado Anschutz Medical CampusCo-Author:  Sarah W. Ball, MPH, ScD – WestatCo-Author:  Katherine E. Fleming-Dutra, MD – Centers for Disease Control and PreventionCo-Author:  Malini DaSilva, MD, MPH – HealthPartners InstituteCo-Author:  Allison L. Naleway, PhD – Kaiser Permanente Center for Health ResearchCo-Author:  Ousseny Zerbo, PhD – Division of Research Kaiser Permanente Vaccine Study CenterCo-Author:  Bruce Fireman, MA – Division of Research Kaiser Permanente Vaccine Study CenterCo-Author:  Brian E. Dixon, PhD – Regenstrief InstituteCo-Author:  Karthik Natarajan, PhD – Columbia UniversityCo-Author:  Mark W. Tenforde, MD, PhD, MPH, DTM&H – US Centers for Disease Control and PreventionCo-Author:  Amanda B. Payne, PhD (she/her/hers) – CDC","Presenting Author:  Ruth Link-Gelles, PhD, MPH – Centers for Disease Control and PreventionCo-Author:  Elizabeth Rowley, DrPH – WestatCo-Author:  Sarah E. Reese, PhD – WestatCo-Author:  Omobosola Akinsete, MD – HealthPartners InstituteCo-Author:  Kristin K. Dascomb, MD. PhD – Intermountain HealthcareCo-Author:  Stephanie Irving, MHS (she/her/hers) – Kaiser Permanente Center for Health ResearchCo-Author:  Nicola P. Klein, MD, PhD (she/her/hers) – Division of Research Kaiser Permanente Vaccine Study CenterCo-Author:  Shaun J. Grannis, MD, MS – Indiana UniversityCo-Author:  Toan Ong, PhD – University of Colorado Anschutz Medical CampusCo-Author:  Sarah W. Ball, MPH, ScD – WestatCo-Author:  Katherine E. Fleming-Dutra, MD – Centers for Disease Control and PreventionCo-Author:  Malini DaSilva, MD, MPH – HealthPartners InstituteCo-Author:  Allison L. Naleway, PhD – Kaiser Permanente Center for Health ResearchCo-Author:  Ousseny Zerbo, PhD – Division of Research Kaiser Permanente Vaccine Study CenterCo-Author:  Bruce Fireman, MA – Division of Research Kaiser Permanente Vaccine Study CenterCo-Author:  Brian E. Dixon, PhD – Regenstrief InstituteCo-Author:  Karthik Natarajan, PhD – Columbia UniversityCo-Author:  Mark W. Tenforde, MD, PhD, MPH, DTM&H – US Centers for Disease Control and PreventionCo-Author:  Amanda B. Payne, PhD (she/her/hers) – CDC"
